Title,Problem Type,Value Score,Validation Count,Current Tools,Pain Points,Use Case,Budget Signals,Urgency,Subreddit,URL
Finally pulling the plug on our POS after the billing surprise… what's actually a good alternative t,management,57,1,,"cost, missing_feature","need anything fancy. just solid inventory tracking, something that works on the devices we already h","$400, $4,800, $20",normal,ecommerce,https://reddit.com/r/ecommerce/comments/1tp96by/finally_pulling_the_plug_on_our_pos_after_the/
Looking for guidance on scaling,general,36,5,,"cost, missing_feature",looking for guidance on scaling,,normal,Entrepreneur,https://reddit.com/r/Entrepreneur/comments/1t1gy1w/looking_for_guidance_on_scaling/
My SaaS has 3 pricing tiers. The cheapest one does all my marketing and most of my customer acquisit,general,36,2,,cost,wante,"$19, $59, $199",normal,SaaS,https://reddit.com/r/SaaS/comments/1tc5y5f/my_saas_has_3_pricing_tiers_the_cheapest_one_does/
How do you actually hire a virtual assistant for a shopify store without it becoming a disaster,general,35,4,shopify,time_consuming,want to hire a virtual assistant to take over customer support but i'm nervous about handing someone,,normal,ecommerce,https://reddit.com/r/ecommerce/comments/1thkqfg/how_do_you_actually_hire_a_virtual_assistant_for/
"Done with Shopify POS fees piling up, what are people actually switching to?",general,32,0,shopify,missing_feature,looking for the best alternative to shopify pos that won't nickel-and-dime me per register or employ,,normal,shopify,https://reddit.com/r/shopify/comments/1tp7hof/done_with_shopify_pos_fees_piling_up_what_are/
"Done with Shopify POS fees piling up, what are people actually switching to?",general,32,0,shopify,missing_feature,looking for the best alternative to shopify pos that won't nickel-and-dime me per register or employ,,normal,shopify,https://reddit.com/r/shopify/comments/1tp7hof/done_with_shopify_pos_fees_piling_up_what_are/
"I made VideoFlow, an open source library to render videos programmatically (alternative to Remotion)",automation,32,1,,manual_process,looking for open-source feedback on:,,normal,webdev,https://reddit.com/r/webdev/comments/1t7ayim/i_made_videoflow_an_open_source_library_to_render/
any good alternative to trustpilot yet?,management,25,2,,,need to find something that actually makes sense long term. heres what we need:,,normal,webdev,https://reddit.com/r/webdev/comments/1t4m5oa/any_good_alternative_to_trustpilot_yet/
