Title,Problem Type,Value Score,Validation Count,Current Tools,Pain Points,Use Case,Budget Signals,Urgency,Subreddit,URL
"Our helpdesk software is a nightmare, whats actually the best ai helpdesk software for 2026?",automation,77,4,"monday, zendesk","cost, complexity",wants quotes for replacements. zendesk at $55 per agent. freshdesk at $15. we already have service n,"$55, $15",normal,SaaS,https://reddit.com/r/SaaS/comments/1rjikl5/our_helpdesk_software_is_a_nightmare_whats/
"Built a scraping API as a cheaper, faster alternative to Firecrawl",integration,56,0,,"cost, complexity","needs. a simple curl request is $0.0002. if the site needs a real browser with captcha solving, that","$0, $0, $79",normal,SaaS,https://reddit.com/r/SaaS/comments/1r2u8gh/built_a_scraping_api_as_a_cheaper_faster/
Typeform is getting expensive. I'm building an alternative - what would make you switch.,management,45,1,,"cost, missing_feature",,,normal,Entrepreneur,https://reddit.com/r/Entrepreneur/comments/1r7rm26/typeform_is_getting_expensive_im_building_an/
What is the best Modash Alternative to manage influencers,automation,44,2,shopify,cost,need a tool which will allow us to manage creators at scale. we sell on shopify and amazon and we ma,,normal,shopify,https://reddit.com/r/shopify/comments/1r9t2xp/what_is_the_best_modash_alternative_to_manage/
What is the real scope of a digital roster system in India? Looking for insights. | i will not promo,automation,42,1,"excel, sheets",manual_process,looking for insights. | i will not promote,,normal,startups,https://reddit.com/r/startups/comments/1rca4om/what_is_the_real_scope_of_a_digital_roster_system/
I need a Powerpoint alternative to make insurance sales presentations?,general,35,2,,missing_feature,need a powerpoint alternative to make insurance sales presentations?,,normal,Entrepreneur,https://reddit.com/r/Entrepreneur/comments/1r7yo5e/i_need_a_powerpoint_alternative_to_make_insurance/
Splitting shipping?,automation,29,2,shopify,,wanting to split up one order when there's certain items being ordered together. i have art prints t,,normal,shopify,https://reddit.com/r/shopify/comments/1r6xcg4/splitting_shipping/
"Fake Testimonials on Landing Page, does Anyone Actually Care?",general,27,0,,missing_feature,need to reach out first?,,normal,SaaS,https://reddit.com/r/SaaS/comments/1row53h/fake_testimonials_on_landing_page_does_anyone/
How do you handle the question? Where is your location,general,27,2,,,,,high,freelance,https://reddit.com/r/freelance/comments/1ro6imj/how_do_you_handle_the_question_where_is_your/
Looking for AI Tool Recommendations - Are These Issues Universal or Tool-Specific?,general,23,3,,missing_feature,looking for ai tool recommendations - are these issues universal or tool-specific?,,normal,Entrepreneur,https://reddit.com/r/Entrepreneur/comments/1r17dwg/looking_for_ai_tool_recommendations_are_these/
cheaper alternatives to productfruits for small teams?,general,23,1,,,want us to jump to the $500 tier cause we hit 4k mau...,"$250, $500, $8",normal,SaaS,https://reddit.com/r/SaaS/comments/1rq3pyf/cheaper_alternatives_to_productfruits_for_small/
