Title,Problem Type,Value Score,Validation Count,Current Tools,Pain Points,Use Case,Budget Signals,Urgency,Subreddit,URL
Scaling my ecommerce store feels impossible – is it just me?,integration,38,4,,cost,,,normal,ecommerce,https://reddit.com/r/ecommerce/comments/1p0e6lv/scaling_my_ecommerce_store_feels_impossible_is_it/
Simple project oversight tools that include invoicing + payments?,management,37,2,,time_consuming,"looking for a time tracking software that goes beyond just logging hours. ideally, something that ca",,normal,SaaS,https://reddit.com/r/SaaS/comments/1ob6kqg/simple_project_oversight_tools_that_include/
Simple project oversight tools that include invoicing + payments?,management,37,2,,time_consuming,"looking for a time tracking software that goes beyond just logging hours. ideally, something that ca",,normal,SaaS,https://reddit.com/r/SaaS/comments/1ob6kqg/simple_project_oversight_tools_that_include/
Looking for a dev. Partner,integration,35,1,,,looking for a dev. partner,,normal,SaaS,https://reddit.com/r/SaaS/comments/1on3wjz/looking_for_a_dev_partner/
Looking for honest feedback on a small SaaS-website builder I’m creating,collaboration,32,6,,cost,looking for honest feedback on a small saas-website builder i’m creating,,normal,SaaS,https://reddit.com/r/SaaS/comments/1owsjx8/looking_for_honest_feedback_on_a_small/
💡 Is there any platform that analyzes your startup idea end-to-end?,integration,32,1,,complexity,"need to hire separate consultants for validation, strategy, and growth plans.",,normal,SaaS,https://reddit.com/r/SaaS/comments/1olvtj8/is_there_any_platform_that_analyzes_your_startup/
Open Source Alternative to Perplexity,integration,27,0,,,,,normal,webdev,https://reddit.com/r/webdev/comments/1oxruai/open_source_alternative_to_perplexity/
How do you validate ideas fast enough without falling into analysis paralysis?,analytics,26,1,,,"needs (just because coding feels more comfortable than talking to people), i wanted to focus on find",,normal,SaaS,https://reddit.com/r/SaaS/comments/1olw8pw/how_do_you_validate_ideas_fast_enough_without/
Helium 10 killed Review Insights – any real alternatives for exporting Amazon reviews with date + st,general,24,0,excel,cost,looking for something that can:,,normal,FulfillmentByAmazon,https://reddit.com/r/FulfillmentByAmazon/comments/1ozbttb/helium_10_killed_review_insights_any_real/
Looking for a mentor-Second-time founder looking for guidance,general,23,0,,,looking for a mentor-second-time founder looking for guidance,$250,normal,Entrepreneur,https://reddit.com/r/Entrepreneur/comments/1okwovc/looking_for_a_mentorsecondtime_founder_looking/
Currently building my first Shopify store and my brain is fried. How do you stay motivated during se,general,20,0,shopify,,,,normal,ecommerce,https://reddit.com/r/ecommerce/comments/1orssj3/currently_building_my_first_shopify_store_and_my/
Alternative to Snipcart?,integration,20,0,,,,,normal,ecommerce,https://reddit.com/r/ecommerce/comments/1p088w9/alternative_to_snipcart/
