Title,Problem Type,Value Score,Validation Count,Current Tools,Pain Points,Use Case,Budget Signals,Urgency,Subreddit,URL
UserGems alternative that won't cost $30k+?,management,62,3,,"complexity, missing_feature",want to know when any of these people move to a new company so we can reach out at the right moment.,"$30, $30",normal,SaaS,https://reddit.com/r/SaaS/comments/1s3z1z1/usergems_alternative_that_wont_cost_30k/
How do you test pricing for your product (meta ads)?,automation,49,3,shopify,"manual_process, cost",,,normal,ecommerce,https://reddit.com/r/ecommerce/comments/1slqbz2/how_do_you_test_pricing_for_your_product_meta_ads/
We need to limit our orders,automation,47,1,shopify,manual_process,need to limit our orders,,normal,shopify,https://reddit.com/r/shopify/comments/1sik8tx/we_need_to_limit_our_orders/
Alternative to QuickBooks?,management,40,1,quickbooks,complexity,"looking for an alternative to quickbooks for accounting, payment processing(debit, credit, and ach),",,normal,smallbusiness,https://reddit.com/r/smallbusiness/comments/1scjtl2/alternative_to_quickbooks/
Is there a more “dev-first” way to handle newsletters?,automation,39,2,mailchimp,manual_process,,,normal,SaaS,https://reddit.com/r/SaaS/comments/1s26hgb/is_there_a_more_devfirst_way_to_handle_newsletters/
Quickbooks alternatives?,management,38,0,"excel, sheets, quickbooks, shopify",,,,normal,smallbusiness,https://reddit.com/r/smallbusiness/comments/1s94949/quickbooks_alternatives/
Would agencies or SMBs actually pay for a modern alternative to cPanel/Plesk for PHP/custom CMS host,automation,33,1,,manual_process,wanted honest feedback from people who manage websites/apps for clients or internal teams.,,normal,webdev,https://reddit.com/r/webdev/comments/1sjqdjn/would_agencies_or_smbs_actually_pay_for_a_modern/
How do you handle billing dates in SaaS subscriptions?,general,30,4,,missing_feature,,,medium,SaaS,https://reddit.com/r/SaaS/comments/1soqwtn/how_do_you_handle_billing_dates_in_saas/
What if you could run Python in the browser at 160KB instead of 20MB? I'm building a compiler to mak,collaboration,28,1,,,,,normal,webdev,https://reddit.com/r/webdev/comments/1sj780c/what_if_you_could_run_python_in_the_browser_at/
"EU Brands: How do you handle shipping to Norway, UK, and Switzerland without killing your margins?",general,26,0,,"cost, missing_feature",,,normal,ecommerce,https://reddit.com/r/ecommerce/comments/1s7zts4/eu_brands_how_do_you_handle_shipping_to_norway_uk/
Looking for Shopify app that allows affiliates to build kits/bundles/product lists of products from ,general,20,0,shopify,,looking for shopify app that allows affiliates to build kits/bundles/product lists of products from ,,medium,shopify,https://reddit.com/r/shopify/comments/1sfpy3y/looking_for_shopify_app_that_allows_affiliates_to/
