Title,Problem Type,Value Score,Validation Count,Current Tools,Pain Points,Use Case,Budget Signals,Urgency,Subreddit,URL
"I’m 13, I saved up $90 cash how do I invest it to start building real capital?",integration,55,3,,,want to use it wisely instead of just spending it.,"$90, $90, $90",normal,Entrepreneur,https://reddit.com/r/Entrepreneur/comments/1nbqj9a/im_13_i_saved_up_90_cash_how_do_i_invest_it_to/
What closed-source dev tools do you wish had good open-source alternatives?,integration,55,0,,"cost, missing_feature",want to contribute more to the open-source ecosystem by building tools that we actually need. instea,,normal,webdev,https://reddit.com/r/webdev/comments/1mslx4r/what_closedsource_dev_tools_do_you_wish_had_good/
Freelancers/Consultants: How do you handle writing the same email 20 times a day without losing your,automation,46,5,,manual_process,,,normal,smallbusiness,https://reddit.com/r/smallbusiness/comments/1ne64ic/freelancersconsultants_how_do_you_handle_writing/
For Agencies - how do  you manage various client Social Media login/passwords?,automation,33,0,,manual_process,,,normal,marketing,https://reddit.com/r/marketing/comments/1n29218/for_agencies_how_do_you_manage_various_client/
Amazon agency or Amazon consultant? Looking for recommendations for my brand.,management,30,2,,,looking for recommendations for my brand.,,normal,FulfillmentByAmazon,https://reddit.com/r/FulfillmentByAmazon/comments/1n1hayr/amazon_agency_or_amazon_consultant_looking_for/
"ColdFusion server down, alternative to ?",management,28,0,,missing_feature,,,normal,webdev,https://reddit.com/r/webdev/comments/1n30o8b/coldfusion_server_down_alternative_to/
Do you think the dead internet theory is correct?,general,25,1,,,,,normal,Entrepreneur,https://reddit.com/r/Entrepreneur/comments/1nb6foc/do_you_think_the_dead_internet_theory_is_correct/
Looking for a better bundle app,general,25,0,shopify,missing_feature,looking for a better bundle app,,normal,ecommerce,https://reddit.com/r/ecommerce/comments/1mvz9r5/looking_for_a_better_bundle_app/
PDF Stamping Alternative to SendOwl?,general,22,0,excel,cost,want to reward the company at all.,,normal,ecommerce,https://reddit.com/r/ecommerce/comments/1mtvwih/pdf_stamping_alternative_to_sendowl/
Is there an app that allows more options + the variant's Image Preview?,general,22,0,shopify,missing_feature,looking for one that can also change the preview image based on the selected options. for example: i,,normal,shopify,https://reddit.com/r/shopify/comments/1n6bi42/is_there_an_app_that_allows_more_options_the/
