Title,Problem Type,Value Score,Validation Count,Current Tools,Pain Points,Use Case,Budget Signals,Urgency,Subreddit,URL
Simple project oversight tools that include invoicing + payments?,management,37,1,,time_consuming,"looking for a time tracking software that goes beyond just logging hours. ideally, something that ca",,normal,SaaS,https://reddit.com/r/SaaS/comments/1ob6kqg/simple_project_oversight_tools_that_include/
Simple project oversight tools that include invoicing + payments?,management,37,1,,time_consuming,"looking for a time tracking software that goes beyond just logging hours. ideally, something that ca",,normal,SaaS,https://reddit.com/r/SaaS/comments/1ob6kqg/simple_project_oversight_tools_that_include/
"Looking for Apify experts who specialize in custom actors for data extraction, any recommendations?",integration,34,0,,missing_feature,"looking for apify experts who specialize in custom actors for data extraction, any recommendations?",,normal,webdev,https://reddit.com/r/webdev/comments/1o6gpxc/looking_for_apify_experts_who_specialize_in/
💡 Is there any platform that analyzes your startup idea end-to-end?,integration,31,0,,complexity,"need to hire separate consultants for validation, strategy, and growth plans.",,normal,SaaS,https://reddit.com/r/SaaS/comments/1olvtj8/is_there_any_platform_that_analyzes_your_startup/
Analytics tools for ecommerce?,integration,31,0,shopify,,"looking for a tool to tie in attribution metrics and shopify metrics so we can track ads, email mark",,normal,ecommerce,https://reddit.com/r/ecommerce/comments/1o994ai/analytics_tools_for_ecommerce/
How do you validate ideas fast enough without falling into analysis paralysis?,analytics,23,1,,,"needs (just because coding feels more comfortable than talking to people), i wanted to focus on find",,normal,SaaS,https://reddit.com/r/SaaS/comments/1olw8pw/how_do_you_validate_ideas_fast_enough_without/
Is it worth starting an online jewelry business right now?,general,22,2,shopify,,looking for honest opinions. thanks in advance. ,,normal,ecommerce,https://reddit.com/r/ecommerce/comments/1nzu9du/is_it_worth_starting_an_online_jewelry_business/
