Title,Problem Type,Value Score,Validation Count,Current Tools,Pain Points,Use Case,Budget Signals,Urgency,Subreddit,URL
How do you test pricing for your product (meta ads)?,automation,49,3,shopify,"manual_process, cost",,,normal,ecommerce,https://reddit.com/r/ecommerce/comments/1slqbz2/how_do_you_test_pricing_for_your_product_meta_ads/
We need to limit our orders,automation,48,1,shopify,manual_process,need to limit our orders,,normal,shopify,https://reddit.com/r/shopify/comments/1sik8tx/we_need_to_limit_our_orders/
Who’s actually feeling the pain of AI API costs?,automation,41,1,,manual_process,,,normal,SaaS,https://reddit.com/r/SaaS/comments/1srfdyk/whos_actually_feeling_the_pain_of_ai_api_costs/
Alternative to QuickBooks?,management,40,1,quickbooks,complexity,"looking for an alternative to quickbooks for accounting, payment processing(debit, credit, and ach),",,normal,smallbusiness,https://reddit.com/r/smallbusiness/comments/1scjtl2/alternative_to_quickbooks/
Looking for guidance on scaling,general,37,7,,"cost, missing_feature",looking for guidance on scaling,,normal,Entrepreneur,https://reddit.com/r/Entrepreneur/comments/1t1gy1w/looking_for_guidance_on_scaling/
Cheap Alternatives To Canva For Presentations (Ones I'd Actually Use),integration,37,0,,time_consuming,"looking for a ppt creator don't waste hours on canva like me, you're better off investing or using f",,normal,SaaS,https://reddit.com/r/SaaS/comments/1sz5v6i/cheap_alternatives_to_canva_for_presentations/
Open thread: looking for real enterprise use cases with chatbase. Share your deployment experience.,collaboration,34,1,"salesforce, zendesk",complexity,looking for real enterprise use cases with chatbase. share your deployment experience.,,normal,SaaS,https://reddit.com/r/SaaS/comments/1ssmt9e/open_thread_looking_for_real_enterprise_use_cases/
Would agencies or SMBs actually pay for a modern alternative to cPanel/Plesk for PHP/custom CMS host,automation,33,1,,manual_process,wanted honest feedback from people who manage websites/apps for clients or internal teams.,,normal,webdev,https://reddit.com/r/webdev/comments/1sjqdjn/would_agencies_or_smbs_actually_pay_for_a_modern/
How do you handle billing dates in SaaS subscriptions?,general,30,4,,missing_feature,,,medium,SaaS,https://reddit.com/r/SaaS/comments/1soqwtn/how_do_you_handle_billing_dates_in_saas/
What if you could run Python in the browser at 160KB instead of 20MB? I'm building a compiler to mak,collaboration,27,1,,,,,normal,webdev,https://reddit.com/r/webdev/comments/1sj780c/what_if_you_could_run_python_in_the_browser_at/
How do you manage workflow for made-to-order products across multiple channels (Shopify + Etsy)?,management,26,0,shopify,,looking for a simple way to:,,normal,shopify,https://reddit.com/r/shopify/comments/1srd6gf/how_do_you_manage_workflow_for_madetoorder/
Anyone here doing Amazon wholesale/reselling in India? Need real insights before I jump in,integration,23,0,,,need real insights before i jump in,,normal,FulfillmentByAmazon,https://reddit.com/r/FulfillmentByAmazon/comments/1steckx/anyone_here_doing_amazon_wholesalereselling_in/
Looking for Shopify app that allows affiliates to build kits/bundles/product lists of products from ,general,21,0,shopify,,looking for shopify app that allows affiliates to build kits/bundles/product lists of products from ,,medium,shopify,https://reddit.com/r/shopify/comments/1sfpy3y/looking_for_shopify_app_that_allows_affiliates_to/
What’s the best web test recorder for reliable playback? Looking for a chrome extension.,general,20,2,,,looking for a chrome extension.,,high,SaaS,https://reddit.com/r/SaaS/comments/1t0rm2c/whats_the_best_web_test_recorder_for_reliable/
